{
    "$schema": "http://json-schema.org/draft/2019-09/schema#",
    "title": "JSON SCHEMA for opentestfactory.org/v1alpha1 AllureCollectorInput manifests",
    "type": "object",
    "properties": {
        "apiVersion": {"type": "string", "pattern": "^opentestfactory.org/v1alpha1$"},
        "kind": {"type": "string", "pattern": "^AllureCollectorInput$"},
        "metadata": {
            "type": "object",
            "properties": {
                "name": {"type": "string"},
                "workflow_id": {"type": "string"},
                "job_id": {"type": "string"},
                "job_origin": {"type": "array", "items": {"type": "string"}},
                "labels": {
                    "type": "object",
                    "patternProperties": {
                        "^([a-zA-Z0-9-.]+/)?[a-zA-Z0-9]([a-zA-Z0-9._-]*[a-zA-Z0-9])?$": {"type": "string"}
                    },
                    "minProperties": 1,
                    "additionalProperties": false
                }
            },
            "additionalProperties": true,
            "required": ["name", "workflow_id"]
        },
        "with": {
            "anyOf": [
                {"type": "object"},
                {"type": "null"}
            ]
        }
    },
    "required": ["apiVersion", "kind", "metadata"],
    "additionalProperties": false
}
